Name,Milk,Region,Description
Great Hill Blue,cow/r,"MA, US",Made by Tim Hill at Great Hill Dairy in MA. Raw cow's milk and blue mold. Aged up to 1 yr. Spicy and rich.
Green Hill,cow/P,"GA, US","A soft-ripened cheese with a white, bloomy rind. Aged 3-6 weeks. It's rich, smooth and easy to eat - but not much distinguishing character."
Green Hill,cow/p,"CA, US",Rich double cream brie like cheese from Sweet Grass Dairy.
Green's Raw Milk Farmhouse Cheddar,cow,UK,From the town of Glastonbury. A delightful cheddar which is hard to stop eating. Very balanced and complex. Green's of Glastonbury is a member of the West Country Farmhouse Cheesemakers.
Gris Vulcan,cow,FR,"Beillevaire, raw milk  see also Grise de Volcans"
Grise des Volcans,cow/r,FR,From Pascal Beillevaire
Grotte del Tufo,sheep,IT,from Southern Tuscany. Tufo means limestone caves. A traditional pecorino style cheese. It is firm and a bit flakey with lot of complexity and a good amount of saltiness.
Gruyère (Gruyere),cow,FR,From Rolf Beeler. Made in the Jura Region.
Gubeen,cow,IRL,Neal’s Yard. Made by Giana Fergueson in Co. Cork.
Guernsey,cow/R,"WA, US",Cheesemaker Sally Jackson wrapped in distinctive grape leaves or chestnut leaves.
Harbourne Blue,goat,ENG,Neal’s Yard. One of the signature cheeses made by Robin Congdon.
Harvest Goat,goat,"MA, US","An aged cheese from Hillman Farms in Colrain, MA."
Haystack Boulder Chevre,goat,"CO, US","Haystack Mountain Goat Dairy in Longmount, CO produces this slightly chalky log. Not a lot of flavor on its own."
Herbiette,goat/R,FR,"From Nantes. Semi-soft creation is given a wondrous coat of herbs, much like Brin d'Amour (corsica) but with a different coating...the herbs include: thyme, savory, juniper, coriander, fennel and cayenne."
Hoch Ybrig,cow,CH,from affineur Rolf Beeler. A mountain cheese made during the summer months washed in a white wine brine. The pate is slightly granular complex with a distinct nuttiness. Melts really well. Try with Riesling.
Holly Springs,goat,"GA, US",A pleasant hard cheese. Not too goaty. Pyrenees style. Good texture.
Hooligan,cow/p,"CT, US","Strong, creamy cheese  with a orange washed-rind. Moderately stinky, with a soft creamy smooth texture. Made with Jersey milk. Bathed twice a week in a mixture of buttermilk and brine. Melts beautifully."
Humboldt Fog,goat,"CA, US",Cypress Grove's Humboldt County cheese is named for the morning fog. It's in the style of the French Morbier with a line of ash running through the center.
Ibores,goat,SP,Dry. Chalky feeling. Spicy acidic finish (like Appenzeller).
Il Caprino del Piemonte,goat,IT,From Piedmonte. A rustic spreadable traditional goat cheese from the mountains of the region.
Island Stream,sheep/p,NZ,A pecorino style cheese. White pate.Very mild. Made by Whitestone.
Isle of Mull Cheddar,cow,SCOT,Made by Jeff Reade. Cows fed hops in Winter. Aged in the Tobermory Distillery on an island off the west coast of Scotland. (Jack's been there!)
Jean Grogne,cow,FR,Triple crème. Creamy and rich. Bloomy rind. Mushroomy but delicate  with a sight bitterness on the finish.
Just Jack,cow,WA,Beecher's. A nice creamy Jack cheese.
La Biquet Poivre,goat,CAN,A pepper coated Fresh chevre from Fromagerie Tournevent in Quebec Canada. Fresh tangy cheese nicely balances with a fresh pepper coating. Joanne liked this one!
La Carre de Pere Antoine Mirabelle,cow,FR,Affine with eau de vie of Mirabelle plums. From the Fromagerie de L'Abbaye.
La Leyenda,sheep/R,SP,Comte-like with a sticky Brandy-washed rind with embedded dried herbs. It has a floral fruity aroma and a multi-dimensional fruity flavor.
La Pierre Doree,goat/r,FR,"Means ""golden stone"".  Pate has a scent of fresh salted butter, and salt. Very clean buttery fragrance with a hint of animal. The cheese has a chalky surface"
La Serena,sheep,SP,From Estremadura. Sheep’s milk when ripe is runny and soft in the center and divine. Try with Shiraz.
La Tur,c-g-s,IT,"From Alta Lange. Made from a blend of pasteurized cow, goat & sheep's milk"
La Yerbera,goat,SP,"Coated with crushed almonds. It has a woodsy, earthy appealing aroma plus a slightly nutty flavor with a sharp but pleasant finish"
Largo,cow,"CA, US","An aged triple crème cheese from Andante Dairy in Santa Rosa. They say it is comparable to La Bouille from Haute-Normandie. We say it is firm, nutty and divine."
Laruns,sheep,FR,A fermier cheese from the Pyreenees. Salty harder texture but still soft. A large hard rind cheese.
Le Chevrot,goat,FR,From Poitou-Charentes an aged goat cheese which is small and round. Depending on it's age the center will have a white chalky consistency while the area closer to the rind has more pronounced flavor. Great for spreading on bread. It is a popular choice.
Le Coeur d'alvignac,goat,FR,"Heart Shaped cheese. Packaged with Rose petal jam for Valentine's day. Made by Les Gariottes in Alvignac, France. A soft-ripened cheese with a mild flavor and saltiness which the sweetness of jam balances."
Le Grain D'Orge,cow,FR,From Normandy. Affine au Calvados.
Le Vache de Chalais,cow,FR,Thermalized cow's milk. Made in Dauphiné.  A little natural rind cow's milk cheese wrapped in chestnut leaves.
Le Welsche,cow/P,FR,Washed with Marc de Gewurtztraminer - An Alsatian munster like soft cheese with a washed rind made by Haxaire.
Lemon Quark,cow,"CA, US",From Spring Hill Jersey in Petaluma. Fluffly quark with a slight bitterness on finish infused with a delicate lemon flavor. Nice with fruit. They also make a plain flavor.
Leonora,goat,SP,"from Miticia. Cheese made from pure alpine goat's milk. Made in Leon, Spain."
Les Levezou,sheep,FR,A pale gold hard rind cheese from the Basque.
Lincolnshire Poacher,cow,UK,Neal’s Yard. Made from Holstein unpasteurised milk.
Livarot,cow,FR,Look for one that's Raffia wrapped.
Livingston Gold,cow/p,NZ,A cheddar-esque cheese. Very mild. Made by Whitestone.
Llangloffan,cow,Wales,Made by Leon & Joan Downey in Castle Morris near Fishguard. Two time Winner of Best Welsh Cheese.
Lord of the Hundreds,sheep/R,ENG,A hard aged ewe's milk cheese. Tastes vaguely like a cross between cheddar and pyrenees sheep. Nutty.
Lyburn Gold,cow,UK,Fine Cheese Co. A mild - medium semi-soft cheese with a nice nutty flavor and slightly buttery element. Melts nicely.
Maccagno,cow,IT,From Central Italy. Aged on Silver fir leaves.
Mad River Roll,cow,"CA, US","A 3"" diameter ripened log of goat cheese. It gets richer and creamier near the center. Named for the Mad River. Usually sold sliced into a round."
Mahon,cow,SP,"From the most northerly of the Balearic Islands in Spain. Versatile, pressed uncooked cheese. Grateable. Mild pleasant subtle flavor."
Manchego,sheep,SP,"A great spanish cheese - hard, slightly salty. Very easy to find. Can be melted and grated. Great with fig or quince paste. Look for longer aged versions (more than 3 months) From La Mancha."
Marco Polo,cow,"WA, US",from Beechers. This Cheddar/Gruyere combo style cheese (Flagship) contains madagascar green peppercorns which gives it a great flavor.
Mascaret,g-s,FR,Small square wrapped in dried chestnut leaves eat inside first before trying rind. nice spicy fall flavor but drier curd with heavier texture white rind. From Provence.
Medora,sheep,IT,From Sardinia. Similar to Pecorino. Dryer and tastes of salt and minerals almost flinty. Grateable.
Metronome,c-g/p,"CA, US",From Andante Dairy. In the shape of an assymetric pyramid (a metronome shape). Thin mold rind with a creamy white interior. Turns slightly runny near the rind with room temp or age.
Midnight Moon,goat,"CA, US",Cypress Grove aged 1 year chevre
Mimolette,cow,FR,A bright orange aged gouda with fantastic crunchy protein crystals in it. Fabulous taste.
Minuet,goat*,"CA, US",A wonderful triple crème goat cheese from Andante Dairy in Santa Rosa. which is enriched with cow's milk crème fraiche from Kendall Farms.
Miticrema,sheep,SP,A spreadable sheep's milk cheese that resembles cream cheese. Acidic - needs to be paired with preserves or ripe fruit or honey! But refreshing and complex.
Moncenisio,,IT,see Bleu de Moncenisio
Mont des Cats,cow,FR,Abbaye de Mont des Cats. A washed rind cheese. Try it in the morning with coffee.
Monte Cristo,sheep/p,NZ,Black wax wrapped pure white semi-soft cheese. Mild. The favorite of the 3 tried from Whitestone.
Monte Enebro,goat,SP,Full–flavored and slightly salty with a goaty aroma. The white paste is surrounded by a more transluscent ring under the ashen colored rind. The cheese is obolong.
Montrachet,goat,FR,"Burgundy. This is a hand-crafted artisanal Montrachet (there are industrial versions as well). A cylindrical mold rinded cheese which wrapped with a chestnut leaf (green or brown) and tied with raffia. It has good acids, with a clean flavor and hint of earth – generally clean and bright and not at all goaty. The rind is soft with mottled blue and white molds."
MouCo Rouge,cow,"CO, US",A natural rind cheese made from pasteurized Jersey and Holstein milk in Ft. Collins. The cheese is soft and creamy with a bit of spicyness.
Mozzarella di Capra,goat,"IA, US",From Green Glade. Very white and firm and salty. A small round ball of fresh goat's milk mozzarella. Quite dense and goaty.
Mrs. Appleby’s Cheshire,cow,ENG,Neal’s Yard selection. Applebys have made Cheshire for generations...Mrs. Appleby is in her 70s.
Mt. Tam,cow,CA,Cowgirl Creamery triple cream named after the local mountain. Made with milk from Straus Family Creamery.
Muenster,cow,FR,"Real Muenster tastes nothing like the sandwich slice. Look for it labeled ""Alsatian Muenster"" and try it with an Alsatian wine! (Jack eats this one once-a-month or so.)"
Murcia al Vino,goat,SP,"From Southeastern Spain. Pressed paste, washed, not cooked. Intense white color. During ripening, the cheese is bathed in red wine twice, giving the rind a red wine/violet color and imparting a strong floral aroma and flavor."
Nantucket,goat,"NY, US",Coach Farms fresh goat. We had the pepper coated version. It is chalky but doesn't have a lot of flavor. Ok but will not seek out again.
Nata Cantabria,cow/p,SP,From Northern Spain. Also known as Queso de Cantabria or queso de nata. A soft cheese aged usually for 2-8 weeks. It has a flat and waxy bright yellow rind. The pate is solid and pale yellow color and had a mild creamy buttery flavor. It is meltable.
Nevat,goat,SP,"Made in Can Pujol. Nevat means snowed in Catalan. It's a soft, ripened goat cheese hand formed into a mountain shape. Really interesting."
Nicolau Farms Chevre,goat,"CA, US",chalky goaty fresh goat cheese.
Nocturne,cow,"CA, US",One of Andante Dairy's cow's milk cheeses. Creamy and when slightly aged a bit runny in the center. Really wonderful. Made in Santa Rosa.
Northern Gold,cow,"CA, US","From Pedrozo Dairy in Orland, California a hard seasonally changing cheese made from milk of pastured raised cows. A semi-hard cheese burnished to the color of freshly churned butter, Northern Gold is smooth and rich with a finishing twang of refreshing fruitiness."
O'Banon,goat,"IN, US",Wrapped in bourbon soaked chestnut leaves.
Oka,cow/r,CAN,"Recipe orginated with Benedictine monks of Brittany (FR). The monks moved to Oka - a village just outside Montreal, Quebec. The cheese today is made under license from the monks by Agropur - one of Canada's largest dairies but it is still aged for 2 months in the monk's cellar. It is comparable to Port Salut - but also has some washed rind interesting characteristics. Jack liked it!"
Old Chatham Shepherd's Wheel,sheep,"NY, US",Made by Old Chatham Sheepherding. Downy white rind with a smooth creamy interior.
Old Wick,sheep,"NJ, US",Made by Valley Shepherd Farm. Aged 6 mos.
Otentique,goat/r,"OR, US","From Juniper Grove. A small cheese with a natural, wrinkled rind, and pleasantly dry texture. Its taste is mild, slightly chalky,"
Panache d'Aramits,sheep,FR,"Dense texture and a smooth, nutty flavor from the Pyrenees."
Pantaleo,goat,IT,From Sardinia. Aged 3 months. A semi hard goat with grassy notes. Good acids on finish almost citrus. Does not taste goaty at all.
Parrano Robusto,cow,NL,See Robusto.
Pata de Mulo,sheep,SP,"""mule's leg"" is flat on one side with a rough surface produced by rolling the curd by hand in a cloth. It is a slightly acidic and salty Spanish cheese from the Northern Castille-Leon Region."
Pave Sauvage,goat,FR,Isigny St. Mere. Fabulously creamy fresh goat. Not too goaty.
Pecorino Foglie di Noci,sheep,IT,Wrapped in walnut leaves. As walnut leaves are available only twice a year this cheese is seasonal. Wonderful nutty flavor. Slightly smokey flavor. Also noted the name as Pecorino in Foja di Noce. Made in Carpegna.
Pecorino Ginepro,sheep,IT,Aged w/Juniper & Balsamico from Tuscany.
Pee Wee Pyramid,goat,"CA, US",From Cypress Grove. A small pyramid which is smooth and creamy with a light acidic mild goat flavor and a mushroomy element. Chalky in the center and more runny near the rind as it ages. Try with a dry red Dolcetto or Merlot or even beer.
Pentu de L'Etang,goat/r,FR,From Pascal Beillevaire
Pepato,sheep/r,"CA, US","Made by Bellwether in Petaluma, CA. Raw sheep's milk with tellicherry peppercorns. Semi-hard with nutty and citrusy flavors. Try with Pinot Noir."
Perail,sheep,FR,From Causses du Larzac. Primeval sheep Country. Not good with sauvignon blanc small-med round white rind
Perdido,cow,"AL, US",Made by Sweet Home Farm in Elberta. Aged 7 months. Golden yellow color with a line of ash down the center. Fantastic with Fig Jam.
Persillé de Tignes,goat,FR,"Savoie. Hand crafted semi-hard raw goat's milk cheese from the Pyrenees (Savoie/Rhone-Alps) region of France.  It has a crumbly, tangy texture that becomes creamier as it ages. It occasionally develops a natural blue flavor."
Petit Fiance des Pyrenees,goat,FR,From the Pyrenees. Reblochon style chevre. Pressed whitish/ivory cheese. It has an appealing flavor with some saltiness. Try serving with a fruit chutney in thin slices.
Petit Marcel,goat,"CA, US","Fresh goat round from Pugs Leap in Healdsburg, CA."
Piave - Aged (Stravecchio/Vecchio),cow,IT,This is wonderful aged hard cheese with a nutty flavor and a great mouthfeel. The Stravecchio is the oldest version. It goes great with Prosecco.
Picolo,cow,"CA, US","A cow's milk triple crème cheese from Andante Dairy in Santa Rosa, which is enriched with Crème Fraiche from Kendall Farms. Slightly nutty flavor. Great with full flavored fruity reds."
Pierce Pt.,cow,"CA, US",Cowgirl Creamery's fall & winter cheese. Made from Straus Organic Dairy's milk and washed in Muscato then rolled in local dried herbs.
Pitchounet,sheep,FR,A farmer in the Parc des Grands-Causses region of France (mid-pyreenes/haut garonne region) has been producing this cheese for over 20 years from a handed down recipe. The pate of the cheese is really white. It has a firm rind. Pitchouet has a delicate almost mushroomy flavor with minerally elements. The cheese is semi-firm with little holes.
Pitxun,sheep,FR,Artisan Basque. Very Hard. Aged like Pecorino.
Pleasant Ridge Reserve,cow/R,"WI, CA","Upland Cheese's washed rind, raw cow's milk cheese. It is a hard cheese in the spirit of Alpine cheese."
Poudre Puff,cow,"CO, US","The Johnsons at Bingham Hill Cheese in Ft. Collins, make these wonderful puffs of pasteurized double cream."
Pozo Tomme,sheep/r,"CA, US",From Rinconada Dairy. A pressed raw milk cheese which is aged for a minimum of two months. It has a natural rind and weighs about 5-6 pounds. Flavors are nutty and rich.
Pug's Leap Chevre,goat,"CA, US","New Farmhouse goat cheese from Healdsburg. Sold in fresh or 1 week old buttons 2-3oz. Slightly sour, cakey texture, not a lot of character."
Purple Haze,goat,"CA, US",Awesome goat chevre flavored with fennel pollen and lavender. Creamy with a great light texture. Spreadable. Added flavors enhance rather than overwhelm. Highly Recommended.
Pyrenees,sheep,FR,Semi soft pate. Nutty and buttery. Smooth.
Queso de Mano,goat/r,"CO, US","Made by Haystack in Longmont, CO. Aged for a minimum of 4 months has a white interior and a nutty flavor with hints of herbal. Lot of saltiness with a dry tangy finish and a goaty element."
Quicke's Farmhouse Cheddar,cow,UK,"Mary Quicke's farmhouse cheese made in Devon, England. Clothbound in cloth, with a spicy almost caramel flavored cheddary pate. Rustic with lots of complexity. Try with stout or ale or lighter red wines."
Ramato Cuvee,cow,IT,"Semi-soft, washed rind cheese from the Treviso in the Veneto region. The cheese is washed with Hy Cuvee Belgian ale, and aged 90 days. Mildly pungent with a pliant, earthy taste."
Raschera d’Alpeggio,c-g-s,IT,Mixed milk from Piedmonte region.  A traditional cheese from around the valleys of Mondovi. The d'Alpeggio designation means it comes from alpine pastures rather than flatland. The semi-soft pate is creamy colored with some tiny holes throughout. Flavors include hints of straw and a slight bitterness of buttermilk-like flavors. The pate has
Reblochon,cow,FR,AOC. Artisan made look for green mark on bottom - white wine smooth golden cream with dark orange gold rind
Red Cloud,goat/r,"CO, US",A small aged washed rind goat cheese made in Boulder by Haystack. Cream colored cheese with a red/gold rind. Salty with a mellow flavor. An interesting diversion.
Red Hawk,cow,"CA, US",Jack's favorite Cowgirl Creamery Cheese. Made from milk from Straus Family Creamery. A triple cream washed-rind cheese. Named after it's orangish colored rind. One of the absolute best US-made cheeses.
Red Leicester,cow,ENG,Hard slightly flakey traditonal cheese with a distinctive red-orange color. Grateable and Cheddar-like but with a slight sweetness. Makes fantastic grilled cheese. Has almost a butterscotch flavor.
Red Spruce (Cheddar),cow/p,"WI, US","From Roth Kase. They make 4, 5, & 7 year. We tried the 7 year cheddar."
Regal de Bourgogne,cow/p,FR,Soft cow's milk cheese covered in white raisins which have been soaked in Eau de mirabelle (plum brandy) A dessert in itself - it is made even more fantastic spread on walnut bread.
Ricotta Dura Stagionata,Sheep,IT,Aged sheep's milk ricotta. Pietra del Sale. Lucana. Made in Avigliano.
Riesling x Sylvaner,cow,GER,Rolf Beeler selection Rawmilchkase  in Wein Weichkase – Bon Cas -
Robiola Castagna DOP,g-c-s,IT,Wrapped in chestnut leaves.
Robiola di Capra Langarola,goat,IT,Crumbly and creamy goat's milk cheese. Meltable. Interesting flavor. Try with Italian whites or Prosecco.
Robiola Di Roccaverano Castagno,goat,IT,Made in Liguria. Roccaverano is the type of goat.
Robiola Sapore di Bosco,cow/P,IT,Made in the Central Alps by Arrigoni. A washed rind cheese aged 50-60 days. Made from the milk of brown alpine cows. A fresh fruity flavor with a pungent nose when aged.
Robiola Vecchia Valsassina,cow,IT,Valsassina is a region in Lombardy  This cheese is young (unaged) Taleggio from this region - aka Robiola. It is square with a pinkish rind and some green mold.
Robiola Vecchia Valsassina,cow/p,IT,Impt by Fresca Italia. A Guffanti selection. A variety of Taleggio in a smaller size - it matures more quickly. Also called Valsassina Robiola.
Robusto,cow,NL,aka Parrano Robusto. An aged gouda with caramel notes and protein crystals but less salty than others and more buttery. Made for the Italian market by a Dutch company. Melts well.
Rocchetta,g-c-s,IT,"From Alta Langhe. Three milk, soft cheese. Runny at room temp. A creamy cheese like Robiola with a honeyesque sweetness. Needs bread. Good! Try again!"
Roccolo,cow,IT,"Arrigoni Valtaleggio. An aged Washed rind cheese rubbed with salt water brine. Try with wines you might drink with seafood - sauvignon blanc, white burgundy."
Roncal,sheep/r,SP,"Hard gray or dark yellow rind. Semi-soft yellow/golden pate. Tastes of mushrooms and straw with a buttery consistency and a bit of fruitiness. One time it was great, another just good."
Rondo,c-gt/p,"CA, US",From Andante Dairy in Santa Rosa. A small round topped with herbes de provence and pink peppercorns from Andante Dairy. The peppercorns adds a great dimension to this cheese which can have almost a liquid center when it has enough age.
Roomano,cow,NL,An aged gouda made with skimmed milk.
Roquefort,sheep/R,FR,AOC. Carles is one of the five producers of this cheese. It is a white slightly moist but crumbly blue veined cheese with a sharp tang.
Rouge et Noir,cow,"CA, US",Made by the Marin French Cheese Co. in Petaluma. An award winning Brie style cheese. We're not huge fans but it's considered excellent by the critics. It has more butterfat than French Brie and is  made from pasteurized milk.
Saenkanter,cow,NL,Aged Gouda from Holland. Caramel flavors and big crunchy protein crystals. Yum.
Salers,cow,FR,From Cantal. Raw and whole milk from summer grazing cows.
San Simon,cow,SP,Smoked over Abedul wood. From Galicia.
Sancerre,goat,FR,Small goat cheese with a natural rind from the Loire Valley - I would guess Sancerre. It was mildy goat and creamy and very balanced.
Sapore Estivo,cow,IT,Herbs are rubbed on the the cheese to impart a mild herbal flavor. From the Veneto region.
Sapori Di Anglona Bianco Nuraghe,sheep,IT,From Sardinia. An Organic pecorino style cheese made with calf’s rennet. It’s almost flakey looking with a tremendous flavor. Buttery slightly salty with a an amazing creamy almost spicy finish. Delicious!
Sara's  Nevat,goat,SP,Made by Josep Cuixart in Catalonia and named after his daughter. Nevat means snowy. This snowy rinded cheese has a mushroomy and very faintly goat flavor - it's high in butterfat and divine at room temperature.
Saumur,goat,FR,AOC. From the Loire.
Sauvageon,g-c/p,FR,From Pascal Beillevaire
Seastack,cow/p,"WA, US",from Mt. Townsend Creamery. Ripened with an ashen coating and dusted with sea salt. Loosely based on Chaource.
Seelander,cow/r,CH,An alpine washed-rind raw cow's milk cheese. The pate is nutty and smooth but also has a fruitiness and complexity from the washed rind.
Selles sur Cher,goat,FR,AOC. A thick disk with an ash covering which has a blue tint. The paste of the Selles sur Cher is pure white.  It can be chalky when young or runny when aged.
Serenita,cow/R,"CA, US",Three Sister's Jersey milk farmstead cheese made in Lindsay. Slightly Cheddar like with a golden lighter complexity - almost a swiss cheese like finish. Slightly salty finish.
Serpa,sheep/r,PT,A traditional cheese from the Alentejo region of Portugal. Made only from Merino sheep milk. Yellow colored rind with smooth rich pate which has a sprinkle of holes and a grassy/herbal nature and a slight sweetness. Rind is rubbed with olive oil. Often is wrapped in a white linen cloth.
Serra Da Estrela,sheep,PT,"From Portugal. Bandage wrapped. Cheese is made with cardoon thistles rennet. One of Jack’s favorites. Runny when young, gets firmer with age."
SF Drake,cow?,"CA, US",A special hard to get cheese from Cowgirl Creamery…. Update - it's available again Oct 2005!
Sharpham Rustic,cow,UK,A Fine Cheese Co Cheese. Made by Debbie Mumford from unpasteurized Jersey milk. It has a white rind and is chalky in the center but soft at the rind. The cheese has nutty silky buttery flavor with elements of a triple-crème
Smokey Blue,cow/r,OR,"From the Rogue Creamery, in Central Point, OR.  A traditional hand-made blue cheese which is smoked overnight in hazelnut shells. The Cheese has a sweet nutty flavor and is a great blue cheese for non-blue eaters to try. We really liked it!"
Sot la Trape,cow,IT,From Friuli Venezia Giulia. Grape-must covered cheese which gives it a violet rind and interesting pineapple-like flavor.
Soumaintrain,cow/r,FR,This one from affineur Herve Mons (raw milk). It is a washed rind cheese in the stinky category with a creamy yellow pate which will run at room temperature and an orange rind. It is round and usually comes in a wooden round box. Both earthy and grassy flavors combine in this highly aromatic cheese which is not to everyone's taste.
St Andrea,cow,IT,Semi-hard cheese with a complex spicy flavor made in Fruili. Salty. Comte-like but softer. Really good! From Latteria St. Andrea - A Guffanti selection.
St Drean,cow,FR,Auvergne. Also known as Le Drean or Le St Drean. A small tomme with a gray and yellow mold speckled rind. Like a cross between Tomme de Savoie and St Nectaire. Has a hazelnut and buttery flavor. Smells like an old wet cellar and straw.
St Felicin,cows,FR,"Made near Grenoble. Salty, soft creamy, round medium small the rind has blueflecks that are okay to eat but the rind changes the flavor. good with sauvignon blanc. Jack liked!"
St. Blaise Grand Modele,sheep/r,FR,From the Perigord region. Washed rind. Dense creamy and nutty flavored cheese. Edible rind. Herve Mons Selection.
St. George,cow,"CA, US","Joe Matos and his wife handcrafted cheese from the milk of their small Santa Rosa, CA herd of cows to make a Portuguese style cheese named after Sao Jorge where they were born. It's made from heat treated but unpasteurized milk. The cheese is slightly cheddar-like with a bit of a bite to it and a richness but it has an unusual flavor element which makes it unlike cheddar. The pate is creamy colored with tiny holes."
St. Nectaire,cow,FR,Pasteurized cow's milk from Auvergne.
St. Pat,cow,"CA, US",Cowgirl Creamery seasonal cheese in Spring. Wrapped with nettles. Made with Straus Family Creamery organic milk. Excellent!
Stanser Fladä,cow,CH,"A Vacherin-style cheese from Joseph (Josef) Barmettler. Soft, creamy spoonable at room temp. Stinky smelling but not strongly flavored. Also known as Chua Fladä."
Stanser Forsterkase,cow,CH,"Rolf Beeler. Made by Joseph Barmettler. A Washed Rind cheese wrapped in fir bark . also called ""Forsterkase"""
Stanser Schafkase (Stanser Schafchäs),sheep,CH,"From Rolf Beeler. Sheep's milk Swiss cheese are unusual. Semi hard but firm with grassy notes. Smooth flavor, slightly stinky and almost slightly spicy. From the Canton de Schwitz region."
