Name,Milk,Region,Description
Stilton,cow,UK,This one from Colton Bassett and selected by Neal's yard. A blue veined aged cow's milk with a strong and distinctive flavor. Best in the Fall.
Sugarbush Cheddar,cow,"VT, US","In Woodstock, VT. We’ve tried the Mellow and Aged Sharp. Coated in wax it’s smooth and creamy aged 6-10 months."
Sybil,goat,"CA, US",Goat's Leap in St. Helena.  This was the fresher version wrapped in fig leaves. The cheese has a chalky texture and delightful fresh flavor. Buy again!
Taleggio,cow,IT,From Lombardy. Becoming commonplace but still wonderful. A stinky cheese with no stinky flavor. Washed Rind. Look for softness and a bit of runnyness in cut cheeses. A chalky firm center shows that it’s not ripe. Quality varies widely.
Teleme,cow/p,"CA, US",From Frank Peluso. The package version is Milky slightly crumbly and almost chalky. The rinded version can be runny at room temperature.
Tenerella - La Perla Del Messere,cow,IT,"From Tuscany. Literally ""Tenderheart"" A fresh mozzarella bag is filled with ricotta cheese and a dollop of cream. Yum. A rare find as it has to be airshipped from Italy and has a short shelf-life."
Thomasville Tomme,cow,"GA, US",A Pyrenees style hard cheese with a nutty flavor. Slight tannic bite reminescent of Cheshire.
Ticklemore,goat,ENG,Neal’s Yard. Made by Robin Congden from South Devon.
Timanoix,cow/p,FR,From Aquitaine. Washed in Walnut brandy which gives it a distinctive nuttiness. Try with Sherry.
Tome de Chalosse,cow,FR,"Chalosse, Aquitaine, France. Washed rind pressed uncooked cheese. Good with red wine."
Tome de Recollets,g-c,FR,"From the Loire. Sauternes washed rind, herb and spice crusted."
Tome de Savoie,cow/R,FR,Mild cheese from Haute-Savoie. Has tiny whole. Semi-hard texture and nutty flavor. Also called Tomme de Baudonnes.
Tome de Villetritouls,sheep/R,FR,From Langeudoc. Mild Complex cheese that is slightly cheddar-like in flavor.
Tome de Yenne,cow/r,FR,see Tommette de Yenne.
Tome du Couserans,cow/R,FR,Pyreenes semi-soft buttery cheese. Made in Bethmale. Mild nutty flavor strong but good liked it w/white wine most like meunster it has holes and is a harder creamy cheese with a pungent flavor.
Tomette,cow,FR,Schmidhauser. From Savoie. A semi soft cheese with a buttery and slightly nutty element.
Tomette des Corbieres,sheep/R,FR,"Jean d'Alos. From the Languedoc. Small, hexagonal yellow cheese."
Tomino da Padella,cow,IT,From Langhe. A small soft mild bloomy rind cheese with almost a slight sweetness. Very creamy.
Tomme Crayeuse,cow,FR,Rich and creamy cheese with a whitish pate. Don't eat the rind.
Tomme de Baudonnes,cow/R,FR,Mild cheese from Haute-Savoie. Has tiny holes in the paste. Semi-hard texture and nutty flavor. Also called Tome de Savoie.
Tomme de Chataigneraie,goat/t,FR,From Puy-de-Dome in Auveryne. Aged up to 7 months by Herve Mons. Chataigneraie means chestnut grove - the goats are put to pasture in a chestnut grove. The cheese is pressed and uncooked. (it's even aged on chestnut planks) It has a grayish rind and a cream colored smooth pate. It looks similar to St. Nectaire but has a distinctive almost foresty flavor - some describe as roasted chestnuts. We liked it alot.
Tomme de Lucciana,sheep/r,FR,Herve Mons. An aged bloomy rind raw sheeps milk cheese from Corsica. The rind is hard.
Tomme de Templiers,goat,FR,A Selection of Herve Mons. From Haut-Garonne. Pressed and raw. A mild tasting cheese with a firm natural rind (brine brushed). Tastes of light colored nuts and straw. Pleasant.
Tommette de Yenne,cow/r,FR,From Rhones-Alpes. Hard whitish gray thick rind. Golden creamy yellow pate. Has notes of comte but more buttery. Semi-hard firm cheese (not grateable) almost a chalky finish with hints of roasted vegetables. A hearty element. Try pairing with an ale and dried fruit (like figs) Great lunch cheese. Might work in a panini. Really likeable.
Tommette Morgee au Seyseel,c/g/r,FR,"Herve Mons. From Haut Savoie.A small round of pressed, pate that is washed in the local fruity white wine, Seyssel. Similar to Tomme de Berger. Soft, savory and fruity."
Tornegus,cow/r,UK,"Duckett's Caerphilly marinated in herbs, brine and wine from Kent. Made by James Aldridge in Godstone in Surrey. Spicy flavor. Semi-hard -Washed rind."
Torta Ambrose,cow,IT,A mild washed rind cheese with a creamy pate. Try with Champagne.
Torta del Casar,sheep,SP,"It is produced in a small artisan dairy in the southwestern town of Almoharín, Casar de Cáceres (Extremadura) from raw merino sheep’s milk. Described as soft, whitish paste with a few holes or thick, molten, porridge-like paste that has to be eaten with a spoon. They use vegetable rennet from the cardoon thistle (in this case – nettles) to coagulate the raw milk."
Tourmalet,sheep,FR,From the Pyrenees. Named after a mountain where it is produced. The hard cheese has a rustic spicy flavor and aroma. Aged about 1 mo. A hit at one of our dinner party's and a favorite of Joanne's.
Toussaint,cow/p,"NY, US",From Sprout Creek Dairy in the Hudson River Valley. A firm cheese with a bit of sharpness and long finish. Very likeable.
Trailhead,cow/p,"WA, US",from Mt. Townsend Creamery. A mountain-style tomme. Like Cantal or Comte.
Tronchetto di Capra al Miele,goat,IT,Soft rindless goat cheese flavored with honey
Tronchon,g-c-s,SP,A mixed milk cheese from Spain with a white paste (creamy white) and no rind. It has a slightly sour aroma.
Tupi de Sort,cow/sh,SP,A standard in the diet of Catalán shepherds. Cheese is softened with olive oil and Aguardiente liqueur then left to ferment. The one we tried was cow's milk. The cheese has a strong flavor (like Romano?) and is best served in or with something (like on pasta or with tomato sauce or a fruit paste).
Two Rock,goat,"CA, US",DeBernardi Dairy in petaluma make small quanities of this raw goat's milk cheese. There is a 1 year and a 4 mo version currently (2006). It is tangy and rich - and not at all goaty. With a great complexity. It is reminescent of a mountain cheese.
Ubriaco all biarra rossa,cow/r,IT,From mitica - raw milk cow's cheese washed with red beer from the Veneto region.
Ubriaco allo schioppettino,cow,IT,Also called Sot la Trape. Grape-must covered cheese which gives it a violet rind and interesting pineapple-like flavor. From Friuli Venezia Giulia.
Vacherin du Jura,cow,FR,Similar to the Mont d'Or in that it's wrapped in spruce bark and is quite aromatic - but made from pasteurized milk.
Vacherin Mont D’Or,cow,FR,Winter cheese wrapped in spruce bark (Gruyere is made in the summer months). A high fat creamy soft cheese. Cheese spoonable at room temperature
Valdeon,cow,SP,A Spanish blue cheese from Castille-Leon. Sometimes sold as Calabres but is much milder. It's wrapped in chestnut leaves.
Valencay,goat,FR,"A 4 sided, flat topped pyramid made from raw goat milk. Natural bloomy rind over an  ash coating ripens for about 4+weeks. Paste is creamy and slightly goaty. Chalky."
Vera Pagliettina,g-c-s,IT,From Piedmonte. Soft smooth oozing cheese with a thin rind. Earthy taste. Eat young.
Vieux Lille,cow/r,FR,From Pascal Beillevaire
Vlaskaas,cow,NL,"Historically, produced for the Flemish harvest festival. A mild creamy golden colored semi-hard cheese with a purple rind. Similar to Gouda but slightly richer and creamier. The one we enjoyed was from Beemster."
Walder,cow/r,AU,"Soft and firm with pea-sized holes. Mild flavor with fruity notes. Made by Alma Cheesemaking Company of Vorarlberg, Austria. Tastes like a creamier Appenzeller or Gruyere. Ripened for a minimum of 140 days. Made by only a few dairies at the Bregenzerwald."
Wildmannli,cow,CH,A Beeler's selection. A tomme-style cheese. Rich and complex. A semi-soft with an really interesting flavor almost flowery notes. A suggestion of saffron.
Winchester Gouda -Super Aged,cow/p,"CA, US",Boere Kaas -(Farm-made) by Winchester Cheese. This 1+ year old aged gouda is slightly bitter in the center with an acid tang and sharpness on the finish.
Winnemere,cow/r,"VT, US",A new washed rind cheese from Jasper Hill wrapped in spruce bark like Vacherin.
Wyfe of Bath,cow/R,ENG,The Fine Cheese Company UK. Gouda-style.
Zamarano,sheep,SP,A spanish dry sheep's milk cheese with hints of caramel and flint. Grateable. Similar to Manchego but with a smoother texture.
